{"$schema":"https://json-schema.org/draft/2020-12/schema","$defs":{"Citation":{"additionalProperties":false,"description":"Backs one narrative claim. Every claim in an AI brief carries at least one.","properties":{"source":{"description":"Source name, e.g. 'FRED'","title":"Source","type":"string"},"url":{"format":"uri","maxLength":2083,"minLength":1,"title":"Url","type":"string"},"note":{"anyOf":[{"type":"string"},{"type":"null"}],"default":null,"description":"What the citation supports","title":"Note"}},"required":["source","url","note"],"title":"Citation","type":"object"},"DeadlineEntry":{"additionalProperties":false,"properties":{"id":{"title":"Id","type":"string"},"title":{"title":"Title","type":"string"},"deadline":{"format":"date-time","title":"Deadline","type":"string"},"recommendation":{"enum":["Pursue","Consider","Pass"],"title":"Recommendation","type":"string"},"fit":{"title":"Fit","type":"integer"}},"required":["id","title","deadline","recommendation","fit"],"title":"DeadlineEntry","type":"object"},"FetchedCounts":{"additionalProperties":false,"properties":{"sam":{"default":0,"title":"Sam","type":"integer"},"grants_gov":{"default":0,"title":"Grants Gov","type":"integer"}},"required":["sam","grants_gov"],"title":"FetchedCounts","type":"object"},"GrantsMeta":{"additionalProperties":false,"properties":{"agent":{"title":"Agent","type":"string"},"schema_version":{"pattern":"^\\d+\\.\\d+\\.\\d+$","title":"Schema Version","type":"string"},"run_id":{"title":"Run Id","type":"string"},"started_at":{"title":"Started At","type":"string"},"finished_at":{"title":"Finished At","type":"string"},"status":{"enum":["ok","stale","failed"],"title":"Status","type":"string"},"data_changed":{"title":"Data Changed","type":"boolean"},"cost_usd":{"minimum":0,"title":"Cost Usd","type":"number"},"model_usage":{"$ref":"#/$defs/ModelUsage"},"sources":{"items":{"$ref":"#/$defs/Source"},"title":"Sources","type":"array"},"warnings":{"items":{"type":"string"},"title":"Warnings","type":"array"},"meta_schema_version":{"default":"1.1.0","pattern":"^\\d+\\.\\d+\\.\\d+$","title":"Meta Schema Version","type":"string"},"sam_budget_exhausted":{"default":false,"title":"Sam Budget Exhausted","type":"boolean"},"sam_requests_used":{"default":0,"title":"Sam Requests Used","type":"integer"}},"required":["agent","schema_version","run_id","started_at","finished_at","status","data_changed","cost_usd","model_usage","sources","warnings","meta_schema_version","sam_budget_exhausted","sam_requests_used"],"title":"GrantsMeta","type":"object"},"KeyStat":{"additionalProperties":false,"properties":{"label":{"title":"Label","type":"string"},"value":{"anyOf":[{"type":"number"},{"type":"null"}],"title":"Value"},"format":{"enum":["currency_compact","currency","percent","percent_signed","pp_signed","count","count_signed","count_signed_thousands","decimal1","days","ratio"],"title":"Format","type":"string"},"delta":{"anyOf":[{"type":"number"},{"type":"null"}],"default":null,"title":"Delta"},"delta_format":{"anyOf":[{"enum":["currency_compact","currency","percent","percent_signed","pp_signed","count","count_signed","count_signed_thousands","decimal1","days","ratio"],"type":"string"},{"type":"null"}],"default":null,"title":"Delta Format"},"good_direction":{"default":"neutral","enum":["up","down","neutral"],"title":"Good Direction","type":"string"}},"required":["label","value","format","delta","delta_format","good_direction"],"title":"KeyStat","type":"object"},"LargestValue":{"additionalProperties":false,"properties":{"amount":{"title":"Amount","type":"number"},"id":{"title":"Id","type":"string"},"title":{"title":"Title","type":"string"}},"required":["amount","id","title"],"title":"LargestValue","type":"object"},"ModelUsage":{"additionalProperties":false,"properties":{"fast":{"$ref":"#/$defs/TierUsage"},"smart":{"$ref":"#/$defs/TierUsage"}},"required":["fast","smart"],"title":"ModelUsage","type":"object"},"PriorAward":{"additionalProperties":false,"description":"One prior award from USAspending.gov (§6.3). Every value is copied from the\nUSAspending response in code; `url` is the award's USAspending page.","properties":{"award_id":{"title":"Award Id","type":"string"},"recipient":{"anyOf":[{"type":"string"},{"type":"null"}],"default":null,"title":"Recipient"},"amount":{"anyOf":[{"type":"number"},{"type":"null"}],"default":null,"title":"Amount"},"start_date":{"anyOf":[{"format":"date","type":"string"},{"type":"null"}],"default":null,"title":"Start Date"},"end_date":{"anyOf":[{"format":"date","type":"string"},{"type":"null"}],"default":null,"title":"End Date"},"awarding_agency":{"anyOf":[{"type":"string"},{"type":"null"}],"default":null,"title":"Awarding Agency"},"url":{"format":"uri","maxLength":2083,"minLength":1,"title":"Url","type":"string"}},"required":["award_id","recipient","amount","start_date","end_date","awarding_agency","url"],"title":"PriorAward","type":"object"},"ProfileSummary":{"additionalProperties":false,"properties":{"id":{"title":"Id","type":"string"},"name":{"title":"Name","type":"string"},"naics":{"items":{"type":"string"},"title":"Naics","type":"array"},"set_asides_eligible":{"items":{"type":"string"},"title":"Set Asides Eligible","type":"array"},"keywords_preview":{"items":{"type":"string"},"title":"Keywords Preview","type":"array"},"profile_hash":{"title":"Profile Hash","type":"string"}},"required":["id","name","naics","set_asides_eligible","keywords_preview","profile_hash"],"title":"ProfileSummary","type":"object"},"RejectedCounts":{"additionalProperties":false,"properties":{"deadline":{"default":0,"title":"Deadline","type":"integer"},"type":{"default":0,"title":"Type","type":"integer"},"agency_excluded":{"default":0,"title":"Agency Excluded","type":"integer"},"set_aside":{"default":0,"title":"Set Aside","type":"integer"},"eligibility":{"default":0,"title":"Eligibility","type":"integer"},"value":{"default":0,"title":"Value","type":"integer"},"place":{"default":0,"title":"Place","type":"integer"},"negative_keyword":{"default":0,"title":"Negative Keyword","type":"integer"},"naics":{"default":0,"title":"Naics","type":"integer"},"psc":{"default":0,"title":"Psc","type":"integer"},"agency":{"default":0,"title":"Agency","type":"integer"},"set_aside_filter":{"default":0,"title":"Set Aside Filter","type":"integer"},"keyword":{"default":0,"title":"Keyword","type":"integer"},"posted":{"default":0,"title":"Posted","type":"integer"},"due":{"default":0,"title":"Due","type":"integer"},"sole_source":{"default":0,"title":"Sole Source","type":"integer"},"no_deadline":{"default":0,"title":"No Deadline","type":"integer"},"unknown_value":{"default":0,"title":"Unknown Value","type":"integer"}},"required":["deadline","type","agency_excluded","set_aside","eligibility","value","place","negative_keyword","naics","psc","agency","set_aside_filter","keyword","posted","due","sole_source","no_deadline","unknown_value"],"title":"RejectedCounts","type":"object"},"ResearchBlock":{"additionalProperties":false,"description":"Bid research brief for a Pursue match (§6.3), from the research agent loop.","properties":{"status":{"enum":["complete","partial"],"title":"Status","type":"string"},"stop_reason":{"title":"Stop Reason","type":"string"},"narrative_source":{"enum":["llm","template"],"title":"Narrative Source","type":"string"},"what_theyre_buying":{"title":"What Theyre Buying","type":"string"},"evaluation_criteria":{"items":{"type":"string"},"title":"Evaluation Criteria","type":"array"},"likely_incumbent":{"anyOf":[{"type":"string"},{"type":"null"}],"default":null,"title":"Likely Incumbent"},"incumbent_notes":{"title":"Incumbent Notes","type":"string"},"prior_awards":{"items":{"$ref":"#/$defs/PriorAward"},"title":"Prior Awards","type":"array"},"risks":{"items":{"type":"string"},"title":"Risks","type":"array"},"go_no_go":{"enum":["go","no_go"],"title":"Go No Go","type":"string"},"rationale":{"title":"Rationale","type":"string"},"citations":{"items":{"$ref":"#/$defs/Citation"},"title":"Citations","type":"array"},"tools_used":{"items":{"type":"string"},"title":"Tools Used","type":"array"},"steps":{"title":"Steps","type":"integer"},"cost_usd":{"title":"Cost Usd","type":"number"},"model":{"title":"Model","type":"string"},"prompt_version":{"title":"Prompt Version","type":"string"},"researched_at":{"title":"Researched At","type":"string"}},"required":["status","stop_reason","narrative_source","what_theyre_buying","evaluation_criteria","likely_incumbent","incumbent_notes","prior_awards","risks","go_no_go","rationale","citations","tools_used","steps","cost_usd","model","prompt_version","researched_at"],"title":"ResearchBlock","type":"object"},"Source":{"additionalProperties":false,"description":"A dataset or page an agent pulled from, shown in the site's source list.","properties":{"name":{"title":"Name","type":"string"},"url":{"format":"uri","maxLength":2083,"minLength":1,"title":"Url","type":"string"},"retrieved_at":{"title":"Retrieved At","type":"string"}},"required":["name","url","retrieved_at"],"title":"Source","type":"object"},"SourceLink":{"additionalProperties":false,"properties":{"name":{"title":"Name","type":"string"},"url":{"format":"uri","maxLength":2083,"minLength":1,"title":"Url","type":"string"}},"required":["name","url"],"title":"SourceLink","type":"object"},"Stats":{"additionalProperties":false,"properties":{"new_since_last_run":{"title":"New Since Last Run","type":"integer"},"closing_within_14d":{"title":"Closing Within 14D","type":"integer"},"active_matches":{"title":"Active Matches","type":"integer"},"largest_value":{"anyOf":[{"$ref":"#/$defs/LargestValue"},{"type":"null"}],"default":null},"fetched":{"$ref":"#/$defs/FetchedCounts"},"rejected":{"$ref":"#/$defs/RejectedCounts"},"below_relevance":{"title":"Below Relevance","type":"integer"},"llm_scored_this_run":{"title":"Llm Scored This Run","type":"integer"},"llm_scored_cached":{"title":"Llm Scored Cached","type":"integer"}},"required":["new_since_last_run","closing_within_14d","active_matches","largest_value","fetched","rejected","below_relevance","llm_scored_this_run","llm_scored_cached"],"title":"Stats","type":"object"},"SubScores":{"description":"LLM rubric sub-scores (§5.4). Code clamps each to its range and sums them.","properties":{"capability":{"title":"Capability","type":"integer"},"eligibility":{"title":"Eligibility","type":"integer"},"size":{"title":"Size","type":"integer"},"timeline":{"title":"Timeline","type":"integer"},"strategic":{"title":"Strategic","type":"integer"}},"required":["capability","eligibility","size","timeline","strategic"],"title":"SubScores","type":"object"},"SummaryBlock":{"additionalProperties":false,"properties":{"what_they_want":{"title":"What They Want","type":"string"},"why_fit":{"items":{"type":"string"},"title":"Why Fit","type":"array"},"risks":{"items":{"type":"string"},"title":"Risks","type":"array"},"next_steps":{"items":{"type":"string"},"title":"Next Steps","type":"array"},"narrative_source":{"enum":["llm","template"],"title":"Narrative Source","type":"string"},"model":{"title":"Model","type":"string"},"generated_at":{"title":"Generated At","type":"string"}},"required":["what_they_want","why_fit","risks","next_steps","narrative_source","model","generated_at"],"title":"SummaryBlock","type":"object"},"Thresholds":{"additionalProperties":false,"properties":{"relevance":{"title":"Relevance","type":"integer"},"pursue":{"title":"Pursue","type":"integer"},"consider":{"title":"Consider","type":"integer"}},"required":["relevance","pursue","consider"],"title":"Thresholds","type":"object"},"TierUsage":{"additionalProperties":false,"properties":{"input_tokens":{"default":0,"title":"Input Tokens","type":"integer"},"output_tokens":{"default":0,"title":"Output Tokens","type":"integer"}},"required":["input_tokens","output_tokens"],"title":"TierUsage","type":"object"},"TopMatch":{"additionalProperties":false,"properties":{"id":{"title":"Id","type":"string"},"source":{"enum":["sam","grants_gov"],"title":"Source","type":"string"},"kind":{"enum":["contract","grant"],"title":"Kind","type":"string"},"notice_type":{"title":"Notice Type","type":"string"},"notice_type_label":{"title":"Notice Type Label","type":"string"},"title":{"title":"Title","type":"string"},"solicitation_number":{"anyOf":[{"type":"string"},{"type":"null"}],"default":null,"title":"Solicitation Number"},"agency":{"anyOf":[{"type":"string"},{"type":"null"}],"default":null,"title":"Agency"},"office":{"anyOf":[{"type":"string"},{"type":"null"}],"default":null,"title":"Office"},"naics":{"items":{"type":"string"},"title":"Naics","type":"array"},"psc":{"anyOf":[{"type":"string"},{"type":"null"}],"default":null,"title":"Psc"},"set_aside_label":{"anyOf":[{"type":"string"},{"type":"null"}],"default":null,"title":"Set Aside Label"},"posted_date":{"format":"date","title":"Posted Date","type":"string"},"deadline":{"anyOf":[{"format":"date-time","type":"string"},{"type":"null"}],"default":null,"title":"Deadline"},"days_left":{"anyOf":[{"type":"integer"},{"type":"null"}],"default":null,"title":"Days Left"},"place":{"anyOf":[{"type":"string"},{"type":"null"}],"default":null,"title":"Place"},"value":{"$ref":"#/$defs/ValueBlock"},"url":{"format":"uri","maxLength":2083,"minLength":1,"title":"Url","type":"string"},"fit":{"title":"Fit","type":"integer"},"sub_scores":{"$ref":"#/$defs/SubScores"},"recommendation":{"enum":["Pursue","Consider","Pass"],"title":"Recommendation","type":"string"},"confidence":{"enum":["low","medium","high"],"title":"Confidence","type":"string"},"reasons":{"items":{"type":"string"},"title":"Reasons","type":"array"},"red_flags":{"items":{"type":"string"},"title":"Red Flags","type":"array"},"is_new":{"title":"Is New","type":"boolean"},"changed":{"title":"Changed","type":"boolean"},"summary":{"anyOf":[{"$ref":"#/$defs/SummaryBlock"},{"type":"null"}],"default":null},"research":{"anyOf":[{"$ref":"#/$defs/ResearchBlock"},{"type":"null"}],"default":null}},"required":["id","source","kind","notice_type","notice_type_label","title","solicitation_number","agency","office","naics","psc","set_aside_label","posted_date","deadline","days_left","place","value","url","fit","sub_scores","recommendation","confidence","reasons","red_flags","is_new","changed","summary","research"],"title":"TopMatch","type":"object"},"ValueBlock":{"additionalProperties":false,"properties":{"kind":{"enum":["award_ceiling","estimated_total","award_amount","none"],"title":"Kind","type":"string"},"amount":{"anyOf":[{"type":"number"},{"type":"null"}],"default":null,"title":"Amount"},"floor":{"anyOf":[{"type":"number"},{"type":"null"}],"default":null,"title":"Floor"}},"required":["kind","amount","floor"],"title":"ValueBlock","type":"object"}},"additionalProperties":false,"properties":{"meta":{"$ref":"#/$defs/GrantsMeta"},"headline":{"title":"Headline","type":"string"},"key_stats":{"items":{"$ref":"#/$defs/KeyStat"},"title":"Key Stats","type":"array"},"profile":{"$ref":"#/$defs/ProfileSummary"},"thresholds":{"$ref":"#/$defs/Thresholds"},"stats":{"$ref":"#/$defs/Stats"},"top_matches":{"items":{"$ref":"#/$defs/TopMatch"},"title":"Top Matches","type":"array"},"deadlines_30d":{"items":{"$ref":"#/$defs/DeadlineEntry"},"title":"Deadlines 30D","type":"array"},"sources":{"items":{"$ref":"#/$defs/SourceLink"},"title":"Sources","type":"array"},"disclaimer":{"title":"Disclaimer","type":"string"}},"required":["meta","headline","key_stats","profile","thresholds","stats","top_matches","deadlines_30d","sources","disclaimer"],"title":"GrantsLatest","type":"object"}