{"meta":{"agent":"grants","schema_version":"1.1.0","run_id":"2026-10-30T18-18-26Z-ce40e2","started_at":"2026-10-30T18:18:26Z","finished_at":"2026-10-30T18:21:34Z","status":"ok","data_changed":true,"cost_usd":0.090982,"model_usage":{"fast":{"input_tokens":19626,"output_tokens":1392},"smart":{"input_tokens":43434,"output_tokens":3378}},"sources":[{"name":"SAM.gov Contract Opportunities","url":"https://sam.gov/","retrieved_at":"2026-10-30T18:18:26Z"},{"name":"Grants.gov","url":"https://www.grants.gov/","retrieved_at":"2026-10-30T18:18:26Z"}],"warnings":[],"meta_schema_version":"1.1.0","sam_budget_exhausted":false,"sam_requests_used":6},"headline":"5 new matches today; 31 close within 14 days. Top: DA01--VA-27-00015330 - Mission-Oriented Services for Application  Integration a… (Veterans Affairs), fit 83.","key_stats":[{"label":"New matches today","value":5.0,"format":"count","delta":null,"delta_format":null,"good_direction":"neutral"},{"label":"Closing ≤ 14 days","value":31.0,"format":"count","delta":null,"delta_format":null,"good_direction":"neutral"},{"label":"Active matches","value":46.0,"format":"count","delta":null,"delta_format":null,"good_direction":"up"},{"label":"Top fit","value":83.0,"format":"count","delta":null,"delta_format":null,"good_direction":"up"}],"profile":{"id":"default","name":"Small software consultancy","naics":["541511","541512"],"set_asides_eligible":["Total Small Business (SBA)","Partial Small Business (SBP)"],"keywords_preview":["software development","web application","data pipeline","cloud migration"],"profile_hash":"a872b5bff1c4375305eb2c0314cfa38761bbcce5e1a93c7e44156e4d8825f4a1"},"thresholds":{"relevance":25,"pursue":75,"consider":55},"stats":{"new_since_last_run":5,"closing_within_14d":31,"active_matches":46,"largest_value":null,"fetched":{"sam":1000,"grants_gov":374},"rejected":{"deadline":59,"type":0,"agency_excluded":0,"set_aside":83,"eligibility":142,"value":32,"place":0,"negative_keyword":33,"naics":0,"psc":0,"agency":0,"set_aside_filter":0,"keyword":0,"posted":0,"due":0,"sole_source":0,"no_deadline":0,"unknown_value":0},"below_relevance":4917,"llm_scored_this_run":13,"llm_scored_cached":61},"top_matches":[{"id":"sam:55e697dc5de74583be5f61d87d4e6731","source":"sam","kind":"contract","notice_type":"sources_sought","notice_type_label":"Sources Sought","title":"DA01--VA-27-00015330 - Mission-Oriented Services for Application  Integration and Capabilities (MOSAIC)","solicitation_number":"36C10B27Q0061","agency":"VETERANS AFFAIRS, DEPARTMENT OF","office":"TECHNOLOGY ACQUISITION CENTER NJ (36C10B)","naics":["541512"],"psc":"DA01","set_aside_label":null,"posted_date":"2026-10-20","deadline":"2026-11-04T14:00:00-06:00","days_left":5,"place":null,"value":{"kind":"none","amount":null,"floor":null},"url":"https://sam.gov/opp/55e697dc5de74583be5f61d87d4e6731/view","fit":83,"sub_scores":{"capability":32,"eligibility":20,"size":8,"timeline":14,"strategic":9},"recommendation":"Pursue","confidence":"medium","reasons":["NAICS 541512 matches primary expertise","Application integration aligns with modernization background","VA is target agency"],"red_flags":[],"is_new":false,"changed":false,"summary":{"what_they_want":"VA is issuing a Sources Sought / RFI to gather information from vendors about application integration and modernization capabilities under the MOSAIC effort, ahead of a possible future solicitation.","why_fit":["NAICS 541512 matches the firm's primary expertise","Application integration work aligns with past modernization projects","VA is a named target agency"],"risks":["This is an RFI, not a funded contract, so no immediate award or value is guaranteed","Deadline note in description says 10:00 a.m. ET but listed deadline is 3:00 PM EST - verify exact time","No clearance or set-aside details confirmed yet"],"next_steps":["Read the full RFI notice and any attachments on SAM.gov for scope details","Confirm the correct response deadline and submission email format with the Contract Specialist","Check incumbent/past award history for similar VA application integration work on USAspending.gov","Prepare a concise capability statement highlighting modernization and integration experience"],"narrative_source":"llm","model":"claude-sonnet-5","generated_at":"2026-10-21T17:43:20Z"},"research":{"status":"partial","stop_reason":"max_tokens","narrative_source":"template","what_theyre_buying":"VETERANS AFFAIRS, DEPARTMENT OF posted: DA01--VA-27-00015330 - Mission-Oriented Services for Application  Integration and Capabilities (MOSAIC).","evaluation_criteria":["Not determined: read the notice and its attachments"],"likely_incumbent":null,"incumbent_notes":"Largest similar prior award found on USAspending.gov: 36C10B18N0003 to ORACLE HEALTH GOVERNMENT SERVICES, INC.; confirm it covers this scope.","prior_awards":[{"award_id":"36C10B18N0003","recipient":"ORACLE HEALTH GOVERNMENT SERVICES, INC.","amount":1511268663.21,"start_date":"2018-05-17","end_date":"2027-08-16","awarding_agency":"Department of Veterans Affairs","url":"https://www.usaspending.gov/award/CONT_AWD_36C10B18N0003_3600_36C10B18D5000_3600"},{"award_id":"36C10B21N10150056","recipient":"BOOZ ALLEN HAMILTON INC","amount":1139008033.13,"start_date":"2021-01-08","end_date":"2025-04-15","awarding_agency":"Department of Veterans Affairs","url":"https://www.usaspending.gov/award/CONT_AWD_36C10B21N10150056_3600_VA11816D1015_3600"},{"award_id":"36C10B21N10050019","recipient":"TISTA SCIENCE AND TECHNOLOGY CORPORATION","amount":553314914.84,"start_date":"2021-09-29","end_date":"2027-03-28","awarding_agency":"Department of Veterans Affairs","url":"https://www.usaspending.gov/award/CONT_AWD_36C10B21N10050019_3600_VA11816D1005_3600"}],"risks":["Requirements are unverified until the full notice and attachments are read"],"go_no_go":"go","rationale":"The rubric rated this Pursue with fit 83. Automated research did not complete (stopped: max_tokens), so this brief is a template.","citations":[{"source":"SAM.gov","url":"https://sam.gov/opp/55e697dc5de74583be5f61d87d4e6731/view","note":"The notice"},{"source":"SAM.gov","url":"https://sam.gov/api/prod/opps/v3/opportunities/resources/files/d85d4866b4de4a96be1b412b1135f9e1/download","note":"attachment_1 (docx)"},{"source":"SAM.gov","url":"https://sam.gov/api/prod/opps/v3/opportunities/resources/files/fcadd28917264d6cb1170a39895a65a4/download","note":"attachment_2 (docx)"},{"source":"USAspending.gov","url":"https://www.usaspending.gov/award/CONT_AWD_36C10B18N0003_3600_36C10B18D5000_3600","note":"Prior award 36C10B18N0003"},{"source":"USAspending.gov","url":"https://www.usaspending.gov/award/CONT_AWD_36C10B21N10150056_3600_VA11816D1015_3600","note":"Prior award 36C10B21N10150056"},{"source":"USAspending.gov","url":"https://www.usaspending.gov/award/CONT_AWD_36C10B21N10050019_3600_VA11816D1005_3600","note":"Prior award 36C10B21N10050019"}],"tools_used":["get_opportunity","list_attachments","read_attachment","usaspending_prior_awards"],"steps":4,"cost_usd":0.0496,"model":"claude-sonnet-5","prompt_version":"v1","researched_at":"2026-10-21T17:43:20Z"}},{"id":"sam:650978c0876c4ea994b6976213322974","source":"sam","kind":"contract","notice_type":"sources_sought","notice_type_label":"Sources Sought","title":"DA01--RFI Action Only    Healthcare Data Auditing Billing and Coding Optimization  Software","solicitation_number":"36C10B27Q0073","agency":"VETERANS AFFAIRS, DEPARTMENT OF","office":"TECHNOLOGY ACQUISITION CENTER NJ (36C10B)","naics":["541519"],"psc":"DA01","set_aside_label":null,"posted_date":"2026-10-23","deadline":"2026-11-06T15:00:00-05:00","days_left":7,"place":null,"value":{"kind":"none","amount":null,"floor":null},"url":"https://sam.gov/opp/650978c0876c4ea994b6976213322974/view","fit":81,"sub_scores":{"capability":32,"eligibility":20,"size":8,"timeline":12,"strategic":9},"recommendation":"Pursue","confidence":"high","reasons":["VA target agency with healthcare data modernization focus","Cloud-based system aligns with AWS/Azure expertise","Data pipeline and dashboard capabilities directly relevant"],"red_flags":[],"is_new":false,"changed":false,"summary":{"what_they_want":"VA is issuing a Request for Information (not a solicitation) to gather industry input on a modern, modular, cloud-based system to support coding, billing, auditing, and revenue cycle activities across VHA, to inform a future acquisition.","why_fit":["VA is a target agency and this is a healthcare data modernization effort aligned with cloud/dashboard/data pipeline skills","Cloud-based, enterprise reporting and workflow needs match AWS/Azure and dashboard experience","No clearance required, consistent with firm's no-clearance profile"],"risks":["This is RFI only — no contract or funding is being awarded now","NAICS 541519 is a secondary code, not a primary NAICS for the firm","Healthcare coding/billing domain expertise (e.g., ICD/CPT coding rules) may be outside current past performance"],"next_steps":["Read the full RFI notice and any attachments on SAM.gov for submission instructions","Confirm SAM.gov registration is current and active","Check USAspending.gov for any incumbent or prior VA coding/billing software contracts","Prepare a capability statement highlighting cloud migration, dashboard, and data pipeline experience relevant to healthcare coding workflows"],"narrative_source":"llm","model":"claude-sonnet-5","generated_at":"2026-10-23T17:32:33Z"},"research":{"status":"complete","stop_reason":"finished","narrative_source":"llm","what_theyre_buying":"VA/VHA (OIT) is conducting market research (RFI, not a solicitation) for a modern, modular, cloud-based enterprise system to support healthcare coding staff, clinical documentation integrity, billing/claim editing, and revenue-cycle compliance functions across VHA facilities. This RFI is intended to inform a future acquisition strategy and potential small-business set-aside determination.","evaluation_criteria":["Evaluation criteria not found (this is an RFI for market research; no